{
 "plan_type": "cycling",
 "plan_id": "norwegian-4x4-progression",
 "plan_version": 2,
 "plan_name": "Норвежский 4x4 -- адаптация и протокол",
 "schema": "2026-04-27T00:00:00Z",
 "created_at": "2026-06-18T18:00:00Z",
 "author": "Claude",
 "notes": "v2: правки по данным сессий 05-17.06 (инертное сердце -- разгон ~1 мин съедает 4-мин интервал; 1-й интервал всегда 0% в зоне; время в зоне растёт 5с->129с->188с -- прогресс есть). ИЗМЕНЕНИЯ: (1) рабочий интервал 4->5 мин (1 разгон + 4 в зоне). (2) восстановление 3->2.5 мин и пол поднят 110-120 -> 125-135 (по факту так и держишь; инертному сердцу выгодно не остывать). (3) НОВОЕ: праймер -- короткий разгон в конце разминки, чтобы не терять 1-й интервал на холодный старт. Общее время 43->45 мин (+2). Цель зоны 150-160 оставлена; реальный HRmax не измерен (наблюдаемый максимум ~154 при RPE 8).",
 "templates": [
  {
   "id": "week3plus-4x4",
   "name": "Неделя 3+: норвежский 4x4 (5-мин интервалы)",
   "equipment": "stationary_bike",
   "notes": "Норвежский 4x4 на рост VO2max. Сердце инертное: разгоняется и восстанавливается медленно -- поэтому длинная разминка, праймер и НЕ полное восстановление. Не пугайся, что 1-й интервал тяжёлый и пульс доезжает до зоны только к середине -- это норма, время в зоне набирается к концу тренировки.",
   "progression": {
    "axis": "intervals",
    "step": {
     "intervals_delta": 1
    },
    "advance_when": "Когда 3 сессии подряд держишь >=60% времени рабочих интервалов в зоне 150-160 -- добавить 5-й интервал или поднять цель на 3-5 bpm."
   },
   "segments": [
    {
     "kind": "warmup",
     "name": "Разминка",
     "duration_seconds": 540,
     "target": {
      "type": "hr_bpm_range",
      "min": 110,
      "max": 125,
      "zone_label": "Z2"
     },
     "notes": "9 мин. Сердце инертное -- дай ему разогнаться плавно, к концу выходи на 125."
    },
    {
     "kind": "steady",
     "name": "Праймер (разгон)",
     "duration_seconds": 60,
     "target": {
      "type": "hr_bpm_range",
      "min": 140,
      "max": 150,
      "zone_label": "Z3-Z4"
     },
     "notes": "НОВОЕ: 1 мин короткого разгона ~145 перед интервалами, чтобы 1-й рабочий не терялся на холодный старт."
    },
    {
     "kind": "interval_block",
     "name": "4x4 (5-мин интервалы)",
     "repeats": 4,
     "children": [
      {
       "kind": "work",
       "name": "Рабочий интервал",
       "duration_seconds": 300,
       "target": {
        "type": "hr_bpm_range",
        "min": 150,
        "max": 160,
        "zone_label": "Z4"
       },
       "notes": "5 мин: ~1 мин разгон + 4 в зоне 150-160. Держи сопротивление/каденс, не сбрасывай когда пульс доезжает. 1-й интервал самый трудный -- это норма."
      },
      {
       "kind": "recovery",
       "name": "Восстановление",
       "duration_seconds": 150,
       "target": {
        "type": "hr_bpm_range",
        "min": 125,
        "max": 135,
        "zone_label": "Z2-Z3"
       },
       "notes": "2.5 мин. НЕ сбрасывай полностью -- держи 125-135. Тёплое сердце быстрее разгонит следующий интервал."
      }
     ]
    },
    {
     "kind": "cooldown",
     "name": "Заминка",
     "duration_seconds": 300,
     "target": {
      "type": "hr_bpm_range",
      "min": 90,
      "max": 110,
      "zone_label": "Z1"
     },
     "notes": "5 мин спокойно, дай пульсу сойти."
    }
   ]
  }
 ]
}